### ISSUE TITLE
Missing { while forwarding json to fluentd

### ISSUE THREAD

**Issue by atefhaloui** [fluent/fluent-bit#3421]
## Bug Report

**Describe the bug**
I'm trying to transmit json entries to a distant fluentd aggregator using the forward output and from what I see the first character of my json log entry if missing `{`.

**To Reproduce**
- fluentbit configuration file:
```
$ cat /etc/td-agent-bit/td-agent-bit.conf
[SERVICE]
    Flush         1
    Log_Level     trace
    Daemon        off
    Parsers_File  parsers.conf
    HTTP_Server   On
    HTTP_Listen   0.0.0.0
    HTTP_Port     2020

[INPUT]
    Name              tail
    Tag               myapp.*
    Path              /home/ahaloui/tmp/*.log
    Path_Key          source
    Parser            myapp
    DB                /home/ahaloui/tmp/flb_app.db
    Mem_Buf_Limit     32MB
    Skip_Long_Lines   Off
    Refresh_Interval  10

[OUTPUT]
    Name   forward
    Match  *
    Host   localhost
    Port   10614
```
- fluend configuration file:
```
<system>
  @log_level debug
</system>

<source>
  @type forward
  bind 0.0.0.0
  port 10614
</source>

<label @FLUENT_LOG>
  # Drop them
  <match fluent.**>
    @type null
  </match>
</label>

<match *.**>
  @type stdout
</match>
```
- create a log file with the following content:
```
{"time":"2021-04-26T12:33:34+0100","level":"info","msg":"this is a test","file":"/dev/data/www.go","func":"api/rest.go","rid":"xxxxxx","ext":"extension"}
```
- This is what I get when the change to the file is commited:
```
2021-04-26 14:01:34 +0200 [info]: starting fluentd-1.12.1 pid=6396 ruby="2.7.2"
2021-04-26 14:01:34 +0200 [info]: spawn command to main:  cmdline=["/opt/td-agent/bin/ruby", "-Eascii-8bit:ascii-8bit", "/opt/td-agent/bin/fluentd", "-c", "/etc/td-agent/td-agent.conf", "--under-supervisor"]
2021-04-26 14:01:35 +0200 [info]: adding match in @FLUENT_LOG pattern="fluent.**" type="null"
2021-04-26 14:01:35 +0200 [info]: adding match pattern="*.**" type="stdout"
2021-04-26 14:01:35 +0200 [info]: adding source type="forward"
2021-04-26 14:01:35 +0200 [info]: #0 starting fluentd worker pid=6401 ppid=6396 worker=0
2021-04-26 14:01:35 +0200 [info]: #0 listening port port=10614 bind="0.0.0.0"
2021-04-26 14:01:35 +0200 [info]: #0 fluentd worker is now running worker=0

2021-04-26 14:54:16.455271493 +0200 myapp.home.ahaloui.tmp.test.log: {"source":"/home/ahaloui/tmp/test.log","log":"time\":\"2021-04-26T12:33:34+0100\",\"level\":\"info\",\"msg\":\"this is a test\",\"file\":\"/dev/data/www.go\",\"func\":\"api/rest.go\",\"rid\":\"xxxxxx\",\"ext\":\"extension\"}"}

2021-04-26 14:58:46 +0200 [info]: Received graceful stop
2021-04-26 14:58:47 +0200 [info]: #0 fluentd worker is now stopping worker=0
2021-04-26 14:58:47 +0200 [info]: #0 shutting down fluentd worker worker=0
2021-04-26 14:58:47 +0200 [info]: #0 shutting down input plugin type=:forward plugin_id="object:870"
2021-04-26 14:58:47 +0200 [info]: #0 shutting down output plugin type=:null plugin_id="object:758"
2021-04-26 14:58:47 +0200 [info]: #0 shutting down output plugin type=:stdout plugin_id="object:780"
2021-04-26 14:58:48 +0200 [info]: Worker 0 finished with status 0
```
- I've made a tcpdump to see what's being transferred because I though that it was a `fluentd` configuration problem:
```
$ sudo tcpdump -vv -x -X -i lo 'tcp and src 127.0.0.1 and port 10614'
tcpdump: listening on lo, link-type EN10MB (Ethernet), capture size 262144 bytes
14:58:10.944817 IP (tos 0x0, ttl 64, id 53163, offset 0, flags [DF], proto TCP (6), length 52)
    localhost.51854 > localhost.10614: Flags [F.], cksum 0xfe28 (incorrect -> 0x7df0), seq 1522863213, ack 2185552826, win 512, options [nop,nop,TS val 2630662547 ecr 2630632550], length 0
	0x0000:  4500 0034 cfab 4000 4006 6d16 7f00 0001  E..4..@.@.m.....
	0x0010:  7f00 0001 ca8e 2976 5ac5 0c6d 8244 e3ba  ......)vZ..m.D..
	0x0020:  8011 0200 fe28 0000 0101 080a 9ccc b993  .....(..........
	0x0030:  9ccc 4466                                ..Df
14:58:10.946421 IP (tos 0x0, ttl 64, id 51533, offset 0, flags [DF], proto TCP (6), length 52)
    localhost.10614 > localhost.51854: Flags [R.], cksum 0xfe28 (incorrect -> 0x08bd), seq 1, ack 1, win 512, options [nop,nop,TS val 2630662549 ecr 2630662547], length 0
	0x0000:  4500 0034 c94d 4000 4006 7374 7f00 0001  E..4.M@.@.st....
	0x0010:  7f00 0001 2976 ca8e 8244 e3ba 5ac5 0c6e  ....)v...D..Z..n
	0x0020:  8014 0200 fe28 0000 0101 080a 9ccc b995  .....(..........
	0x0030:  9ccc b993                                ....
14:58:13.945724 IP (tos 0x0, ttl 64, id 57225, offset 0, flags [DF], proto TCP (6), length 60)
    localhost.51856 > localhost.10614: Flags [S], cksum 0xfe30 (incorrect -> 0xe416), seq 509212529, win 65495, options [mss 65495,sackOK,TS val 2630665548 ecr 0,nop,wscale 7], length 0
	0x0000:  4500 003c df89 4000 4006 5d30 7f00 0001  E..<..@.@.]0....
	0x0010:  7f00 0001 ca90 2976 1e59 f771 0000 0000  ......)v.Y.q....
	0x0020:  a002 ffd7 fe30 0000 0204 ffd7 0402 080a  .....0..........
	0x0030:  9ccc c54c 0000 0000 0103 0307            ...L........
14:58:13.945833 IP (tos 0x0, ttl 64, id 0, offset 0, flags [DF], proto TCP (6), length 60)
    localhost.10614 > localhost.51856: Flags [S.], cksum 0xfe30 (incorrect -> 0x3691), seq 3918750163, ack 509212530, win 65483, options [mss 65495,sackOK,TS val 2630665548 ecr 2630665548,nop,wscale 7], length 0
	0x0000:  4500 003c 0000 4000 4006 3cba 7f00 0001  E..<..@.@.<.....
	0x0010:  7f00 0001 2976 ca90 e993 61d3 1e59 f772  ....)v....a..Y.r
	0x0020:  a012 ffcb fe30 0000 0204 ffd7 0402 080a  .....0..........
	0x0030:  9ccc c54c 9ccc c54c 0103 0307            ...L...L....
14:58:13.945852 IP (tos 0x0, ttl 64, id 57226, offset 0, flags [DF], proto TCP (6), length 52)
    localhost.51856 > localhost.10614: Flags [.], cksum 0xfe28 (incorrect -> 0x5d4d), seq 1, ack 1, win 512, options [nop,nop,TS val 2630665548 ecr 2630665548], length 0
	0x0000:  4500 0034 df8a 4000 4006 5d37 7f00 0001  E..4..@.@.]7....
	0x0010:  7f00 0001 ca90 2976 1e59 f772 e993 61d4  ......)v.Y.r..a.
	0x0020:  8010 0200 fe28 0000 0101 080a 9ccc c54c  .....(.........L
	0x0030:  9ccc c54c                                ...L
14:58:13.946105 IP (tos 0x0, ttl 64, id 57227, offset 0, flags [DF], proto TCP (6), length 86)
    localhost.51856 > localhost.10614: Flags [P.], cksum 0xfe4a (incorrect -> 0xc4df), seq 1:35, ack 1, win 512, options [nop,nop,TS val 2630665548 ecr 2630665548], length 34
	0x0000:  4500 0056 df8b 4000 4006 5d14 7f00 0001  E..V..@.@.].....
	0x0010:  7f00 0001 ca90 2976 1e59 f772 e993 61d4  ......)v.Y.r..a.
	0x0020:  8018 0200 fe4a 0000 0101 080a 9ccc c54c  .....J.........L
	0x0030:  9ccc c54c 92bf 6d79 6170 702e 686f 6d65  ...L..myapp.home
	0x0040:  2e61 6861 6c6f 7569 2e74 6d70 2e74 6573  .ahaloui.tmp.tes
	0x0050:  742e 6c6f 6791                           t.log.
14:58:13.946115 IP (tos 0x0, ttl 64, id 17441, offset 0, flags [DF], proto TCP (6), length 52)
    localhost.10614 > localhost.51856: Flags [.], cksum 0xfe28 (incorrect -> 0x5d2b), seq 1, ack 35, win 512, options [nop,nop,TS val 2630665548 ecr 2630665548], length 0
	0x0000:  4500 0034 4421 4000 4006 f8a0 7f00 0001  E..4D!@.@.......
	0x0010:  7f00 0001 2976 ca90 e993 61d4 1e59 f794  ....)v....a..Y..
	0x0020:  8010 0200 fe28 0000 0101 080a 9ccc c54c  .....(.........L
	0x0030:  9ccc c54c                                ...L
14:58:13.946187 IP (tos 0x0, ttl 64, id 57228, offset 0, flags [DF], proto TCP (6), length 256)
    localhost.51856 > localhost.10614: Flags [P.], cksum 0xfef4 (incorrect -> 0x90ea), seq 35:239, ack 1, win 512, options [nop,nop,TS val 2630665548 ecr 2630665548], length 204
	0x0000:  4500 0100 df8c 4000 4006 5c69 7f00 0001  E.....@.@.\i....
	0x0010:  7f00 0001 ca90 2976 1e59 f794 e993 61d4  ......)v.Y....a.
	0x0020:  8018 0200 fef4 0000 0101 080a 9ccc c54c  ...............L
	0x0030:  9ccc c54c 92d7 0060 86b8 e510 28b7 9282  ...L...`....(...
	0x0040:  a673 6f75 7263 65ba 2f68 6f6d 652f 6168  .source./home/ah
	0x0050:  616c 6f75 692f 746d 702f 7465 7374 2e6c  aloui/tmp/test.l
	0x0060:  6f67 a36c 6f67 d998 2274 696d 6522 3a22  og.log.."time":"
	0x0070:  3230 3231 2d30 342d 3236 5431 323a 3333  2021-04-26T12:33
	0x0080:  3a33 342b 3031 3030 222c 226c 6576 656c  :34+0100","level
	0x0090:  223a 2269 6e66 6f22 2c22 6d73 6722 3a22  ":"info","msg":"
	0x00a0:  7468 6973 2069 7320 6120 7465 7374 222c  this.is.a.test",
	0x00b0:  2266 696c 6522 3a22 2f64 6576 2f64 6174  "file":"/dev/dat
	0x00c0:  612f 7777 772e 676f 222c 2266 756e 6322  a/www.go","func"
	0x00d0:  3a22 6170 692f 7265 7374 2e67 6f22 2c22  :"api/rest.go","
	0x00e0:  7269 6422 3a22 7878 7878 7878 222c 2265  rid":"xxxxxx","e
	0x00f0:  7874 223a 2265 7874 656e 7369 6f6e 227d  xt":"extension"}
14:58:13.946193 IP (tos 0x0, ttl 64, id 17442, offset 0, flags [DF], proto TCP (6), length 52)
    localhost.10614 > localhost.51856: Flags [.], cksum 0xfe28 (incorrect -> 0x5c60), seq 1, ack 239, win 511, options [nop,nop,TS val 2630665548 ecr 2630665548], length 0
	0x0000:  4500 0034 4422 4000 4006 f89f 7f00 0001  E..4D"@.@.......
	0x0010:  7f00 0001 2976 ca90 e993 61d4 1e59 f860  ....)v....a..Y.`
	0x0020:  8010 01ff fe28 0000 0101 080a 9ccc c54c  .....(.........L
	0x0030:  9ccc c54c                                ...L
^C
9 packets captured
18 packets received by filter
0 packets dropped by kernel
```

**Expected behavior**
It's expected that the full json log entry is transmitted without being truncated.
Actually, I've got `"time":"2021-04-26T12:33:34+0100","level":"info","msg":"this is a test","file":"/dev/data/www.go","func":"api/rest.go","rid":"xxxxxx","ext":"extension"}` instead of `{"time":"2021-04-26T12:33:34+0100","level":"info","msg":"this is a test","file":"/dev/data/www.go","func":"api/rest.go","rid":"xxxxxx","ext":"extension"}`

**Your Environment**
* Version used: fluentbit v1.7.4 & fluend v4.1.0-1
* Configuration: 
* Environment name and version (e.g. Kubernetes? What version?):
* Server type and version:
* Operating System and version: ubuntu 20.04
* Filters and plugins:

**Comment by atefhaloui** [comment]
My mistake :( This issue is irrelevant as a non printable chararter was introduced by my application.
I'm closing it.
